{
  "schema_version": 1,
  "launch_allowlist": [
    ".venv/bin/ancestry",
    "pnpm"
  ],
  "output_allowlist": [
    "docs/assets/screenshots/terminal/cli-help.png",
    "docs/assets/screenshots/terminal/interactive-console.png"
  ],
  "determinism": {
    "locale": "en_US.UTF-8",
    "timezone": "UTC",
    "theme": "light",
    "fonts": {
      "electron": {
        "family": "Inter",
        "size_px": 16,
        "weight": 400,
        "source_policy": "capture-adapter-bundled"
      },
      "terminal": {
        "family": "JetBrains Mono",
        "size_px": 14,
        "weight": 400,
        "source_policy": "capture-adapter-bundled"
      }
    },
    "animations": "disabled",
    "fixed_timestamp": "2040-01-02T03:04:05Z",
    "fixed_username": "Fictional Researcher",
    "path_policy": "fixture-relative",
    "id_seed": "ancestryllm-docs-v1",
    "volatile_data": "fixture-only",
    "network": "deny"
  },
  "fixtures": [
    {
      "id": "success",
      "state": "success",
      "path": "tests/fixtures/docs_screenshots/success.json",
      "provider": "none",
      "network": "disabled",
      "fictional": true
    },
    {
      "id": "degraded",
      "state": "degraded",
      "path": "tests/fixtures/docs_screenshots/degraded.json",
      "provider": "none",
      "network": "disabled",
      "fictional": true
    },
    {
      "id": "electron-degraded",
      "state": "degraded",
      "path": "tests/fixtures/docs_screenshots/electron-degraded.json",
      "provider": "none",
      "network": "disabled",
      "fictional": true
    },
    {
      "id": "privacy-canary",
      "state": "privacy-canary",
      "path": "tests/fixtures/docs_screenshots/privacy-canary.json",
      "provider": "none",
      "network": "disabled",
      "fictional": true
    }
  ],
  "scenarios": [
    {
      "id": "terminal-cli-help",
      "surface": "terminal",
      "launch": [
        ".venv/bin/ancestry",
        "--help"
      ],
      "fixture_id": "success",
      "geometry": {
        "kind": "terminal",
        "columns": 96,
        "rows": 36
      },
      "ready_signal": {
        "kind": "text",
        "value": "usage: ancestry"
      },
      "output_path": "docs/assets/screenshots/terminal/cli-help.png",
      "documentation": [
        {
          "path": "docs/reference/CLI.md",
          "anchor": "command-line-reference"
        }
      ],
      "comparison": {
        "mode": "exact"
      },
      "inclusion": {
        "target_ui_element": "Synthetic terminal adapter fixture",
        "placement": "Test fixture only; never published in documentation.",
        "text_insufficiency": "Exercises the retained terminal adapter isolation contract using fictional data.",
        "crop_context": "Synthetic adapter fixture; no public documentation image is retained.",
        "alt_text": "Synthetic terminal adapter isolation fixture.",
        "ui_location_exception": {
          "rationale": "Test-only fixture for adapter security regression coverage; not a publication approval.",
          "review_url": "https://example.invalid/test-fixture-review"
        }
      }
    },
    {
      "id": "terminal-interactive-console",
      "surface": "terminal",
      "launch": [
        ".venv/bin/ancestry"
      ],
      "fixture_id": "success",
      "geometry": {
        "kind": "terminal",
        "columns": 96,
        "rows": 36
      },
      "ready_signal": {
        "kind": "text",
        "value": "ancestry >"
      },
      "output_path": "docs/assets/screenshots/terminal/interactive-console.png",
      "documentation": [
        {
          "path": "docs/how-to/explore-the-interactive-console.md",
          "anchor": "inspect-the-supported-gedcom-commands"
        },
        {
          "path": "docs/CONSOLE.md",
          "anchor": "navigation-and-controls"
        }
      ],
      "comparison": {
        "mode": "exact"
      },
      "inclusion": {
        "target_ui_element": "Synthetic terminal adapter fixture",
        "placement": "Test fixture only; never published in documentation.",
        "text_insufficiency": "Exercises the retained terminal adapter isolation contract using fictional data.",
        "crop_context": "Synthetic adapter fixture; no public documentation image is retained.",
        "alt_text": "Synthetic terminal adapter isolation fixture.",
        "ui_location_exception": {
          "rationale": "Test-only fixture for adapter security regression coverage; not a publication approval.",
          "review_url": "https://example.invalid/test-fixture-review"
        }
      }
    }
  ]
}
